title,genres,keywords,overview
Avatar,Action adventure fantasy,marine avatar alien world,A marine on an alien planet becomes torn between following orders and protecting the world he feels is his home.
Titanic,Romance drama,love ship iceberg tragedy,A seventeen-year-old falls in love with a kind but poor artist aboard the luxurious Titanic.
The Avengers,Action sci-fi,superhero marvel team earth defense,Earth’s mightiest heroes must come together to fight an alien invasion.
Interstellar,Sci-fi adventure space,space blackhole time relativity,A team travels through a wormhole in space to ensure humanity’s survival.
The Dark Knight,Action crime drama,batman joker gotham,A vigilante fights crime in Gotham while facing his greatest foe.
